<eras:Compendium xmlns:eras="http://www.erasmusG4-6.org"
    xmlns:xsi="http://www.w3.org/2001/XMLSchema-instance"
    xmlns:ita="http://www.italiaeras.org"
    xsi:schemaLocation="http://www.erasmusG4-6.org erasmus.xsd 
                        http://www.italiaeras.org italia.xsd">
    <Alumno>
        <ita:ExtPersonalInformation>
            <Name>John Doe</Name>
            <Gender>M</Gender>
            <Email>john.doe@example.com</Email>
            <Nationality>Spain</Nationality>
            <ita:PizzaPreference>Pizza al pastrami</ita:PizzaPreference>
            <ita:GelatoPreference>KKKKKKKKK Gelato</ita:GelatoPreference>
        </ita:ExtPersonalInformation>
        
        <OriginUniversity>
            <Degree>Bachelor of Science in Computer Science</Degree>
            <Institution>University of Example</Institution>
            <CreditsAchieved>120</CreditsAchieved>
        </OriginUniversity>
        <ita:ITA_EducationTypeDestination>
            
            <Degree>Computer Engineering</Degree>
            <Institution>University of Another Example</Institution>
            <StartDate>2024-09-01</StartDate>
            <EndDate>2025-05-31</EndDate>
            <numberOfSubjects>10</numberOfSubjects>
            <Subject>
                <Name>Data Structures</Name>
                <Credits>6</Credits>
                <Description>An introductory course to data structures.</Description>
                <Specialization>Computer Science</Specialization>
            </Subject>
            <Subject>
                <Name>Data Structures</Name>
                <Credits>6</Credits>
                <Description>An introductory course to data structures.</Description>
                <Specialization>Computer Science</Specialization>
            </Subject>
            <Subject>
                <Name>Data Structures</Name>
                <Credits>6</Credits>
                <Description>An introductory course to data structures.</Description>
                <Specialization>Computer Science</Specialization>
            </Subject>
            <Subject>
                <Name>Data Structures</Name>
                <Credits>6</Credits>
                <Description>An introductory course to data structures.</Description>
                <Specialization>Computer Science</Specialization>
            </Subject>
            <Subject>
                <Name>Data Structures</Name>
                <Credits>6</Credits>
                <Description>An introductory course to data structures.</Description>
                <Specialization>Computer Science</Specialization>
            </Subject>
            
            <ita:Region>Abruzzo</ita:Region>
        </ita:ITA_EducationTypeDestination>
        <!-- Nuevo elemento ExperienceType -->
        <Experience>
            <Position></Position>
            <Employer></Employer>
            <StartDate>2024-09-01</StartDate>
            <EndDate>2024-12-30</EndDate>
        </Experience>
    </Alumno>
    
    <!-- Alumno 2 -->
    <Alumno>
        <ita:ExtPersonalInformation>
            <Name>Jane Smith</Name>
            <Gender>F</Gender>
            <Email>jane.smith@example.com</Email>
            <Nationality>Germany</Nationality>
            <ita:PizzaPreference>Pizza con todo</ita:PizzaPreference>
            <ita:GelatoPreference>Chocolate Gelato</ita:GelatoPreference>
            <Allergies>Alimentary</Allergies>
        </ita:ExtPersonalInformation>
        
        <OriginUniversity>
            <Degree>Bachelor of Arts in History</Degree>
            <Institution>University of Another Country</Institution>
            <CreditsAchieved>100</CreditsAchieved>
        </OriginUniversity>
        
        <ita:ITA_EducationTypeDestination>
            <Degree>History</Degree>
            <Institution>University of Yet Another Example</Institution>
            <StartDate>2024-09-01</StartDate>
            <EndDate>2025-05-30</EndDate>
            <numberOfSubjects>10</numberOfSubjects>
            <Subject>
                <Name>European History</Name>
                <Credits>4</Credits>
                <Description>An overview of European history.</Description>
                <Specialization>History</Specialization>
            </Subject>
            <!-- More subjects can be added here -->
        </ita:ITA_EducationTypeDestination>
        
        <Experience>
            <Position>Research Assistant</Position>
            <Employer>Historical Society</Employer>
            <StartDate>2024-09-01</StartDate>
            <EndDate>2024-12-31</EndDate>
        </Experience>
    </Alumno>
</eras:Compendium>
